{
  "$schema": "https://json-schema.org/draft/2020-12/schema",
  "$id": "https://mainframe-env.invalid/schemas/release-provenance@1",
  "title": "mainframe-env SLSA release provenance",
  "type": "object",
  "required": ["_type", "subject", "predicateType", "predicate"],
  "properties": {
    "_type": {"const": "https://in-toto.io/Statement/v1"},
    "subject": {"type": "array", "minItems": 2},
    "predicateType": {"const": "https://slsa.dev/provenance/v1"},
    "predicate": {"type": "object"}
  }
}
