{
  "_type": "https://in-toto.io/Statement/v1",
  "predicate": {
    "buildDefinition": {
      "buildType": "mainframe-env.cargo-release@1",
      "externalParameters": {
        "all_features": true,
        "locked": true,
        "profile": "release",
        "target": "x86_64-unknown-linux-gnu"
      },
      "resolvedDependencies": [
        {
          "digest": {
            "sha256": "a369af7a1f653e58316a0384703377f20d8ca31730ad71c51e1afb35a37d4f2c"
          },
          "uri": "Cargo.lock"
        },
        {
          "digest": {
            "sha256": "16a9ab344f780e98c4f9770a8a3a6295266dc705b73f89239c4d23c63e28b1ae"
          },
          "uri": "build-inputs.json"
        },
        {
          "digest": {
            "sha256": "4b95607b1143d254d62b23ef2afc5d7f180a5a299859e9345515ee0de97c7d40"
          },
          "uri": "source-tree"
        }
      ]
    },
    "runDetails": {
      "builder": {
        "id": "mainframe-env-cargo/x86_64-unknown-linux-gnu"
      },
      "metadata": {
        "invocationId": "mainframe-env-v0.8.0-x86_64-unknown-linux-gnu-local"
      }
    }
  },
  "predicateType": "https://slsa.dev/provenance/v1",
  "subject": [
    {
      "digest": {
        "sha256": "d4912742e0b9b49c19f2cd0a167423daaeeb21bc66eff3df7ddcfb098ca1bf3d"
      },
      "name": "mainframe-env-server"
    },
    {
      "digest": {
        "sha256": "03880529a64ab9c287f9e4b453051d80b1b0aba68d95ab0dcaada2155d200042"
      },
      "name": "mainframe-env"
    }
  ]
}
