{
  "_type": "https://in-toto.io/Statement/v1",
  "predicate": {
    "buildDefinition": {
      "buildType": "mainframe-env.cargo-release@1",
      "externalParameters": {
        "all_features": true,
        "locked": true,
        "profile": "release",
        "target": "aarch64-apple-darwin"
      },
      "resolvedDependencies": [
        {
          "digest": {
            "sha256": "2a03a5eb50040875e0a722d2efe0e51c0431223639ca41abd6079236f9d133b6"
          },
          "uri": "Cargo.lock"
        },
        {
          "digest": {
            "sha256": "d035e7116875e8e07097933ae69bbd64549a3a52d233066a90b554f7e6d99d65"
          },
          "uri": "build-inputs.json"
        },
        {
          "digest": {
            "sha256": "d57dc772395cdab703c2dc8a09d363898ea2ab229ad3cb37ed3923254c29ea77"
          },
          "uri": "source-tree"
        }
      ]
    },
    "runDetails": {
      "builder": {
        "id": "mainframe-env-cargo/aarch64-apple-darwin"
      },
      "metadata": {
        "invocationId": "mainframe-env-v0.3.0-aarch64-apple-darwin-local"
      }
    }
  },
  "predicateType": "https://slsa.dev/provenance/v1",
  "subject": [
    {
      "digest": {
        "sha256": "d19bc2570ddfb087f58e2d45414ffcc80bf18f703419870e863272be22fe4b61"
      },
      "name": "mainframe-env-server"
    },
    {
      "digest": {
        "sha256": "83d818b7de5d2abf0cc42f4d394fa1f52bcd5bb215af08bad94dae768e1ae306"
      },
      "name": "mainframe-env"
    }
  ]
}
